{
  "schema_version": "1.0.0",
  "profile_hash": "91e7cac63cfdbde0de436fdb8fc521b728057ccce92440dbfbecff85f6079d2f",
  "signed_payload": {
    "profile_id": "77777777-7777-4777-8777-777777777771",
    "validation_class": "C3",
    "target_release_id": "release-20260720-c0",
    "target_release_manifest_hash": "1111111111111111111111111111111111111111111111111111111111111111",
    "exact_match": {
      "code_commit": "aaaaaaaaaaaaaaaaaaaaaaaaaaaaaaaaaaaaaaaa",
      "architecture": "amd64",
      "image_manifest_hash": "2222222222222222222222222222222222222222222222222222222222222222",
      "dependency_lock_hash": "4444444444444444444444444444444444444444444444444444444444444444",
      "sbom_hash": "4444444444444444444444444444444444444444444444444444444444444444",
      "openapi_hash": "7a94b979b559a83b44dd70db4ab19cf111118bc0eabfbb450cf2eb87add6eaa5",
      "domain_events_hash": "69183d15f1478b52c0723f4a4b885b60f1c16740fa7321e8c49ddc57115dc9d4",
      "migration_head": "0001",
      "strategy_package_hash": "194bcbe9d523428845f5b9db421fb818bed699b7faa59f89fb387f65fffd8fcf",
      "system_config_hash": "129b6ed9b5d188930b0178a65e6807023dd6f9ddaa399a78f5da812dac59d623",
      "risk_config_hash": "450be30cffa3b82494d07b0e23be4a355c3f55162bcd296b41a4feaf9b5cb4d3",
      "universe_config_hash": "ff486eee9745c24344fecfa19f434784b42c47f3be7b6feb800bef3f199eb477",
      "price_action_schema_hash": "d2305132fb4bfc4752bc1f5b889ee5ecb4344e0dbdafb1b744a5612e3577df63",
      "price_action_config_hash": "69f9f2c78c7079b1eefa5a20b88aafdf9d7bda2b50ff4b800d4e4629dceaa9d5",
      "rate_budget_config_hash": "cda78f9fe14cad870fd81839b260d02273a99c91566937b9caf60390ac5c0db3",
      "rate_budget_schema_hash": "fe6c147ee87053bab3351dd6b6dd507144635bb6f6e365cea2255ef87214bbc5",
      "endpoint_cost_catalog_hash": "1fef756ce6628a65b27b6ea6d42da7548475ba102ff683479eb16c80b7ded485",
      "endpoint_cost_catalog_schema_hash": "5a38a543cd9827af9826109657952dee424ce06d462eaaac8cf7f78f697fe33a",
      "network_egress_policy_hash": "2ad5689e456db9e02047a4b68d16d7182c97fc4f1660894eaa581953d4642c93",
      "testnet_protocol_probe_plan_hash": "9edde0a9698cd05c060be63fbbb4698931fe820a28f1337b7763a71fa4a40c1f",
      "of_search_plan_hash": "99937c29ae83d6548c732c5890d240e3e12aaa02b45b9555d746421a754d2b24",
      "of_parameter_candidate_hash": "f376b08f4d895a75cea62794d9993064a564e4c70c4a19e117658585759d85e0",
      "of_parameter_manifest_hash": "ffd0157eec843c1e6736f15fe1183c00f41d496ff337410c1e455dca19b031b5",
      "cost_model_schema_hash": "c66bdb51c464e36e00cde41abb8800aecf767f54402061703859adc735d2c950",
      "execution_model_schema_hash": "9b6d489003e57322133fdaec57486d5973aae4b4021f2d1db8ee739a398fedba",
      "edge_decision_schema_hash": "2a4695bb93cc8ab1e0182b07072185a845421f523d7efab1f95675c7a7185230",
      "strategy_health_schema_hash": "fa9f4a1e30875ce7b33135e22443277aeb4da407b6ad03fe324743e3d910b49e",
      "codex_review_schema_hash": "2b99ee0357b8076f46fbc0513a1fd05b963e28ac628ab2055f833c92581a2bcc",
      "execution_semantics_manifest": {
        "execution_model_hash": "d581fe402814d4ec34fc992e5a7628681081a64484924b83c73664ab09815451",
        "order_state_machine_hash": "aeaeaeaeaeaeaeaeaeaeaeaeaeaeaeaeaeaeaeaeaeaeaeaeaeaeaeaeaeaeaeae",
        "exchange_adapter_contract_hash": "afafafafafafafafafafafafafafafafafafafafafafafafafafafafafafafaf",
        "native_protection_policy_hash": "b0b0b0b0b0b0b0b0b0b0b0b0b0b0b0b0b0b0b0b0b0b0b0b0b0b0b0b0b0b0b0b0",
        "cost_model_hash": "8dcf8b3152925b6b96e79771b92f7687219010ae4c8d6533ce76c497ba33a864"
      },
      "execution_semantics_hash": "b39ce89aa71a780042c721ee0605f5556963439d9278bf8e67d784cb15690a9d",
      "normalized_compose_hash": "cccccccccccccccccccccccccccccccccccccccccccccccccccccccccccccccc",
      "cgroup_cpu_cores": 2,
      "cgroup_memory_bytes": 12884901888
    },
    "allowed_differences": [
      "/runner/host_id",
      "/runner/instance_id",
      "/runner/boot_id",
      "/runner/static_ip",
      "/runtime/compose_project",
      "/runtime/database_names",
      "/runtime/database_roles",
      "/runtime/queue_namespaces",
      "/runtime/order_prefixes",
      "/runtime/redis_namespaces",
      "/runtime/archive_namespace",
      "/runtime/heartbeat_namespace",
      "/runtime/volume_paths",
      "/runtime/secret_refs",
      "/runtime/testnet_endpoint",
      "/runtime/testnet_credential_ref"
    ],
    "runner_attestation": {
      "host_id": "validation-host-kr-01",
      "instance_id": "instance-20260720-01",
      "boot_id": "boot-20260720-01",
      "os_name": "Ubuntu",
      "os_version": "24.04",
      "kernel_release": "6.8.0-generic",
      "architecture": "amd64",
      "docker_version": "docker-28.3.1",
      "compose_version": "compose-2.38.1",
      "country_code": "KR",
      "region_id": "kr-approved-region",
      "network_path_hash": "dddddddddddddddddddddddddddddddddddddddddddddddddddddddddddddddd",
      "static_ip_fingerprint": "eeeeeeeeeeeeeeeeeeeeeeeeeeeeeeeeeeeeeeeeeeeeeeeeeeeeeeeeeeeeeeee",
      "disk_type": "NVME",
      "disk_capacity_bytes": 200000000000,
      "disk_quota_bytes": 200000000000,
      "cgroup_cpu_cores": 2,
      "cgroup_memory_bytes": 12884901888,
      "attestation_bundle_hash": "ffffffffffffffffffffffffffffffffffffffffffffffffffffffffffffffff"
    },
    "validation_evidence": {
      "observation_started_at": "2026-07-20T00:00:00Z",
      "observation_ended_at": "2026-07-23T00:00:00Z",
      "network_observation_hours": 72,
      "shadow_healthy_hours": 72,
      "rtt_loss_disconnect_hash": "1212121212121212121212121212121212121212121212121212121212121212",
      "clock_hash": "1313131313131313131313131313131313131313131313131313131313131313",
      "cpu_steal_hash": "1414141414141414141414141414141414141414141414141414141414141414",
      "disk_io_hash": "1515151515151515151515151515151515151515151515151515151515151515",
      "resource_curve_hash": "1616161616161616161616161616161616161616161616161616161616161616",
      "field_diff_report_hash": "1717171717171717171717171717171717171717171717171717171717171717",
      "equivalence_report_hash": "1818181818181818181818181818181818181818181818181818181818181818",
      "unapproved_difference_count": 0
    },
    "isolation_attestation": {
      "production_key_present": false,
      "production_database_present": false,
      "production_volume_present": false,
      "production_control_channel_present": false,
      "testnet_credential_ref": "docker-secret:testnet_validation_key",
      "isolation_report_hash": "1919191919191919191919191919191919191919191919191919191919191919"
    },
    "cleanup_attestation": {
      "runner_stopped": true,
      "testnet_credential_revoked": true,
      "ephemeral_secrets_destroyed": true,
      "cleanup_report_hash": "2020202020202020202020202020202020202020202020202020202020202020"
    },
    "issued_at": "2026-07-23T00:10:00Z",
    "expires_at": "2026-07-30T00:10:00Z",
    "nonce": "validation-equivalence-c3-20260723"
  },
  "signature": {
    "algorithm": "Ed25519",
    "key_id": "owner-signing-key-2026q3",
    "signature_ref": "signatures/validation-equivalence-c3.sig"
  }
}
